{
  "mode": "DOI_DOWNLOAD",
  "status": "partial",
  "request": {
    "mode": "DOI_DOWNLOAD",
    "dois": [
      "10.1007/978-3-031-76459-2_3",
      "10.1145/3341105.3373962",
      "10.1016/j.softx.2019.100367",
      "10.48550/arXiv.2312.13041",
      "10.1609/aaai.v31i1.10804",
      "10.48550/arXiv.1907.00503",
      "10.1613/jair.953",
      "10.48550/arXiv.2407.08839",
      "10.1109/ACCESS.2025.3646769",
      "10.1109/ICASSP55912.2026.11460610",
      "10.48550/arXiv.2608.27172",
      "10.1109/TIFS.2024.3350911",
      "10.3390/s23188014",
      "10.1016/j.cose.2022.103054",
      "10.3390/s22145243",
      "10.1007/s00779-019-01332-y",
      "10.3390/computers15060368",
      "10.1109/TR.2018.2805763",
      "10.3390/fi17010008",
      "10.1109/TIFS.2025.3583234",
      "10.3390/jcp2040039",
      "10.1109/ACCESS.2023.3296707",
      "10.1109/e-Science62913.2024.10678662"
    ],
    "outdir": "C:/Users/Admin/Documents/Second Brain/Ω/FILES/PDF/Paper",
    "invalid_dois": [],
    "defaults_applied": []
  },
  "result": {
    "requested_count": 23,
    "valid_dois": [
      "10.1007/978-3-031-76459-2_3",
      "10.1145/3341105.3373962",
      "10.1016/j.softx.2019.100367",
      "10.48550/arXiv.2312.13041",
      "10.1609/aaai.v31i1.10804",
      "10.48550/arXiv.1907.00503",
      "10.1613/jair.953",
      "10.48550/arXiv.2407.08839",
      "10.1109/ACCESS.2025.3646769",
      "10.1109/ICASSP55912.2026.11460610",
      "10.48550/arXiv.2608.27172",
      "10.1109/TIFS.2024.3350911",
      "10.3390/s23188014",
      "10.1016/j.cose.2022.103054",
      "10.3390/s22145243",
      "10.1007/s00779-019-01332-y",
      "10.3390/computers15060368",
      "10.1109/TR.2018.2805763",
      "10.3390/fi17010008",
      "10.1109/TIFS.2025.3583234",
      "10.3390/jcp2040039",
      "10.1109/ACCESS.2023.3296707",
      "10.1109/e-Science62913.2024.10678662"
    ],
    "invalid_dois": [],
    "downloaded_count": 13,
    "failed_count": 10,
    "items": [
      {
        "doi": "10.1007/978-3-031-76459-2_3",
        "status": "metadata_only",
        "method": null,
        "path": null,
        "sha256": null,
        "title": "ModSec-Learn: Boosting ModSecurity with Machine Learning",
        "is_oa": true,
        "full_text_available": false,
        "evidence_level": "metadata_only",
        "chain_attempted": [
          "arxiv_direct",
          "unpaywall",
          "europe_pmc",
          "openalex",
          "scihub_fallback",
          "metadata_only"
        ],
        "attempts": [
          {
            "resolver": "arxiv_direct",
            "candidates": [],
            "outcome": "no_candidates",
            "error": null
          },
          {
            "resolver": "unpaywall",
            "candidates": [
              "https://hdl.handle.net/11584/440487"
            ],
            "outcome": "failed",
            "error": "http_403"
          },
          {
            "resolver": "europe_pmc",
            "candidates": [],
            "outcome": "no_candidates",
            "error": null
          },
          {
            "resolver": "openalex",
            "candidates": [],
            "outcome": "no_candidates",
            "error": null
          },
          {
            "resolver": "scihub_fallback",
            "candidates": [],
            "outcome": "failed",
            "error": "scihub_cli_no_pdf_exit_1: 2026-09-11 15:57:50,969 - WARNING - No untried download URL candidates remain | 2026-09-11 15:57:50,969 - ERROR - Failed to download 10.1007/978-3-031-76459-2_3: No untried download URL candidates remain | 2026-09-"
          },
          {
            "resolver": "metadata_only",
            "candidates": [],
            "outcome": "failed",
            "error": null
          }
        ],
        "failure_class": "blocked_403",
        "warnings": [],
        "manual_urls": [
          "https://doi.org/10.1007/978-3-031-76459-2_3",
          "https://hdl.handle.net/11584/440487"
        ],
        "error": "http_403"
      },
      {
        "doi": "10.1145/3341105.3373962",
        "status": "downloaded",
        "method": "cache",
        "path": "C:\\Users\\Admin\\Documents\\Second Brain\\Ω\\FILES\\PDF\\Paper\\WAF-A-MoLE.pdf",
        "sha256": "bb07fc242dd0dc1daf3d373eafd67663627550a2e3efb04b3bf8e8aa6b5ba346",
        "title": "WAF-A-MoLE",
        "is_oa": null,
        "full_text_available": true,
        "evidence_level": "full_text",
        "chain_attempted": [
          "cache"
        ],
        "attempts": [],
        "failure_class": "none",
        "warnings": [],
        "manual_urls": [],
        "error": null
      },
      {
        "doi": "10.1016/j.softx.2019.100367",
        "status": "downloaded",
        "method": "cache",
        "path": "C:\\Users\\Admin\\Documents\\Second Brain\\Ω\\FILES\\PDF\\Paper\\WAF-A-MoLE_An_adversarial_tool_for_assessing_ML-based_WAFs.pdf",
        "sha256": "a383560f63b7ed0c4c242f308fa8223197423fbd1d44dc05cea263f92792d0aa",
        "title": "WAF-A-MoLE: An adversarial tool for assessing ML-based WAFs",
        "is_oa": null,
        "full_text_available": true,
        "evidence_level": "full_text",
        "chain_attempted": [
          "cache"
        ],
        "attempts": [],
        "failure_class": "none",
        "warnings": [],
        "manual_urls": [],
        "error": null
      },
      {
        "doi": "10.48550/arXiv.2312.13041",
        "status": "downloaded",
        "method": "cache",
        "path": "C:\\Users\\Admin\\Documents\\Second Brain\\Ω\\FILES\\PDF\\Paper\\10.48550_arXiv.2312.13041.pdf",
        "sha256": "9e32572e0853fa5a13cca769d73b0e48851596596f774b85e309e05b4b68c9e7",
        "title": null,
        "is_oa": null,
        "full_text_available": true,
        "evidence_level": "full_text",
        "chain_attempted": [
          "cache"
        ],
        "attempts": [],
        "failure_class": "none",
        "warnings": [],
        "manual_urls": [],
        "error": null
      },
      {
        "doi": "10.1609/aaai.v31i1.10804",
        "status": "downloaded",
        "method": "cache",
        "path": "C:\\Users\\Admin\\Documents\\Second Brain\\Ω\\FILES\\PDF\\Paper\\SeqGAN_Sequence_Generative_Adversarial_Nets_with_Policy_Gradient.pdf",
        "sha256": "695925fe3cf303544bbcffdf73a7c45371f5b87ae2ffcac9b0eca2a5ad4b7474",
        "title": "SeqGAN: Sequence Generative Adversarial Nets with Policy Gradient",
        "is_oa": null,
        "full_text_available": true,
        "evidence_level": "full_text",
        "chain_attempted": [
          "cache"
        ],
        "attempts": [],
        "failure_class": "none",
        "warnings": [],
        "manual_urls": [],
        "error": null
      },
      {
        "doi": "10.48550/arXiv.1907.00503",
        "status": "downloaded",
        "method": "cache",
        "path": "C:\\Users\\Admin\\Documents\\Second Brain\\Ω\\FILES\\PDF\\Paper\\10.48550_arXiv.1907.00503.pdf",
        "sha256": "4361a02973c5a0adcbc1111afab74215fca36f2835af25bfd974970015d93468",
        "title": null,
        "is_oa": null,
        "full_text_available": true,
        "evidence_level": "full_text",
        "chain_attempted": [
          "cache"
        ],
        "attempts": [],
        "failure_class": "none",
        "warnings": [],
        "manual_urls": [],
        "error": null
      },
      {
        "doi": "10.1613/jair.953",
        "status": "downloaded",
        "method": "cache",
        "path": "C:\\Users\\Admin\\Documents\\Second Brain\\Ω\\FILES\\PDF\\Paper\\SMOTE_Synthetic_Minority_Over-sampling_Technique.pdf",
        "sha256": "8eece9837dbc7719b42d1c89be2030a5c0d328723612b05cd170d2c83854899f",
        "title": "SMOTE: Synthetic Minority Over-sampling Technique",
        "is_oa": null,
        "full_text_available": true,
        "evidence_level": "full_text",
        "chain_attempted": [
          "cache"
        ],
        "attempts": [],
        "failure_class": "none",
        "warnings": [],
        "manual_urls": [],
        "error": null
      },
      {
        "doi": "10.48550/arXiv.2407.08839",
        "status": "downloaded",
        "method": "cache",
        "path": "C:\\Users\\Admin\\Documents\\Second Brain\\Ω\\FILES\\PDF\\Paper\\10.48550_arXiv.2407.08839.pdf",
        "sha256": "2644af7a3c6d286feabc3b04a24103a6350ba1cef397ca1bd6fa50fd5a107f4a",
        "title": null,
        "is_oa": null,
        "full_text_available": true,
        "evidence_level": "full_text",
        "chain_attempted": [
          "cache"
        ],
        "attempts": [],
        "failure_class": "none",
        "warnings": [],
        "manual_urls": [],
        "error": null
      },
      {
        "doi": "10.1109/ACCESS.2025.3646769",
        "status": "downloaded",
        "method": "cache",
        "path": "C:\\Users\\Admin\\Documents\\Second Brain\\Ω\\FILES\\PDF\\Paper\\Architectural_Selection_Framework_for_Synthetic_Network_Traffic_Quantifying_the_Fidelity_Utility_Trade-off.pdf",
        "sha256": "4441d0adc0eb9dc84c2393faac3cbce2c6a226b4dbc2c881e6c74f3d6b648f09",
        "title": "Architectural Selection Framework for Synthetic Network Traffic: Quantifying the Fidelity–Utility Trade-off",
        "is_oa": null,
        "full_text_available": true,
        "evidence_level": "full_text",
        "chain_attempted": [
          "cache"
        ],
        "attempts": [],
        "failure_class": "none",
        "warnings": [],
        "manual_urls": [],
        "error": null
      },
      {
        "doi": "10.1109/ICASSP55912.2026.11460610",
        "status": "metadata_only",
        "method": null,
        "path": null,
        "sha256": null,